{
  "apiVersion": "fabric.singleaxis.dev/v1alpha1",
  "kind": "FabricDeployment",
  "metadata": {"name": "payments-agent-prod"},
  "spec": {
    "assuranceLevel": "A3",
    "connection": {
      "mode": "gateway",
      "tenantIdFrom": "tenant-identity",
      "workloadIdentityRef": "payments-spiffe-binding-v2"
    },
    "controls": {
      "profileRef": "payments-agent-controls-v4",
      "policyRef": "payments-policy-v12",
      "authorizationRef": "payments-tool-authorization-v7",
      "piiRef": "payments-pii-v3",
      "guardrailRef": "payments-guardrails-v5",
      "escalationRef": "payments-escalation-v2"
    },
    "observe": {
      "contentMode": "hash-only",
      "relayRef": "regulated-relay-eu-west"
    },
    "assurance": {"planRef": "payments-release-gate-v7"},
    "rollout": {"approvalRef": "change-1842"}
  }
}
